label_tec,original_phrase,before,matching_report_sentence,after,report_id,rank,cosine_score
T1059,jpin can use the command-line utility cacls.exe to change file permissions.,"• inject content into the lsass.exe process, in order to load the keylogger module into lsass and call its exported function.• communicate via ftp. • send email via smtp.",• change permissions on files using the cacls.exe command-line utility.,"jpin can also target mobile suite applications and extract data from them. the backdoor contains code that looks for installed instances of symbian, blackberry, and windows phone management applications.",66f55a9e3063d29485700197,3389,0.8154106102844737
T1203,they have also used zero-day exploits.,"the different backdoors written by or for the group indicate a considerable investment over time. research indicates that platinum has used multiple backdoors concurrently at times, which could represent either multiple teams within the activity group performing different campaigns, or different versions of the tools being used against varying victim networks.",• zero day exploits.,"platinum has used several zero-day exploits against their victims. regardless of whether they researched the exploits themselves or purchased them from independent researchers, the monetary investment required to collect and deploy zero-day exploits at this level is considerable.",66f55a9e3063d29485700197,3452,0.8152144330550952
T1083,jpin can enumerate drives and their types.,"after it is installed and started, the jpin service can perform the following tasks, among others: • obtain information about the computer, such as operating system version, user name, privileges, disk space, and so on. • list running services, processes, job ids, and task ids.",• enumerate drives and their types.,• enumerate registry keys. • load a custom keylogger.,66f55a9e3063d29485700197,3379,0.8271897007149128
T1105,jpin can download files and upgrade itself.,• load a custom keylogger. • download files.,• download and upgrade itself.,"• acquire network information such as dns, ip, proxies, and so on. • exfiltrate information over http get and post requests, with the data stored either within the http body or within the url parameters.",66f55a9e3063d29485700197,3383,0.7920700869235389
T1071,jpin can send email over smtp.,"• lower security settings by tampering with registry keys. • inject content into the lsass.exe process, in order to load the keylogger module into lsass and call its exported function.• communicate via ftp.",• send email via smtp.,• change permissions on files using the cacls.exe command-line utility. jpin can also target mobile suite applications and extract data from them.,66f55a9e3063d29485700197,3388,0.7072174568759437
T1069,adversaries may attempt to find local system groups and permission settings.,discovery the actor executed commands to gather system information discovery t1082 information about local drives. the actor gathered information about system owner/user discovery t1033 successful logons to the host using a powershell command.,permission groups discovery: the actor attempt to find local system t1069.001 local groups groups and permission settings.,permission groups discovery: the actor used commands to enumerate t1069.002 doman groups the active directory structure. system network configuration the actor used commands to enumerate t1016 discovery the network topology.,66f55adf3063d294857001a1,2786,0.7562186488446229
T1069,"-list /groups on macos, and groups on linux can list local groups.","major confounding factors in this analysis developments. overlay activity spikes in threat activity— are the use of common contractors and operational captured in internal monitoring and external reporting— resources (e.g., tooling, infrastructure) across prc threat with geopolitical activity to investigate possible causes.",groups.,"this insight can prioritize proactive hunt and  indicators and warnings: when facing a challenge, the prc defensive measures tailored to relevant groups’ tactics, typically uses multiple forms of power concurrently, since a techniques, and procedures (ttp). single policy (e.g., cyberattacks) is unlikely to have a 4factors increasing the likelihood of targeting by prc cyberattack operations this chart identifies factors that increase an organization’s likelihood of becoming the target or being impacted by a prc cyberattack, based on the case studies in this report.",66f55bfa3063d294857001a5,3466,0.7230671491568552
T1003,"by default, the ntds file  is located in %systemroot%\\ntds\\ntds.dit of a domain controller.",additional information on wmi events and tracing can be found in the references section of the advisory. ntds.dit active directory database the actor may try to exfiltrate the ntds.dit file and the system registry hive from windows domain controllers (dcs) out of the network to perform password cracking [t1003.003].,"(the ntds.dit file is the main active directory (ad) database file and, by default, is stored at %systemroot%\\\\ntds\\\\ntds.dit.","this file contains information about users, groups, group memberships, and password hashes for all users in the domain; the system registry hive contains the boot key that is used to encrypt information in the ntds.dit file.) although the ntds.dit file is locked while in use by ad, a copy can be made by creating a volume shadow copy and extracting the ntds.dit file from the shadow copy.",66f55adf3063d294857001a1,2637,0.777696148704137
T1190,"apt29 has exploited cve-2019-19781 for citrix, cve-2019-11510 for pulse secure vpns, cve-2018-13379 for fortigate vpns, and cve-2019-9670 in zimbra software to gain access.","in recent attacks targeting covid-19 vaccine research and development, the group conducted basic vulnerability scanning against specific external ip addresses owned by the organisations. the group then deployed public exploits against the vulnerable services identified.the group has been successful using recently published exploits to gain initial footholds.","examples include, but are not limited to: • cve-2019-19781 citrix [1] • cve-2019-11510 pulse secure [2] • cve-2018-13379 fortigate [2] • cve-2019-9670 zimbra [3] the group likely seeks to take full advantage of a variety of new exploits when publicised.","more information about these exploits can be found in previous ncsc advisories on citrix and vpn vulnerabilities [1,2]. the group also uses spear-phishing to obtain authentication credentials to internet- accessible login pages for target organisations.",66f55ca63063d294857001b6,4786,0.7638036833118754
T1484,"for example, this may be used to forge saml tokens, without the need to compromise the signing certificate to forge new credentials.","for example, each cloud once apt29 had gained on-premises access to an organization’s application can define a token-decrypting certificate, which is environment, mandiant observed them targeting on-premises used to encrypt the saml token as it is transmitted to the cloud ad fs servers with the goal of obtaining the token-signing resource. this option is not widely used.",certificate to forge saml tokens.,"there are two steps an note: if an ad fs server farm model is leveraged, the same token- attacker must take to obtain the token-signing certificate and signing and decryption certificates are used by all the ad fs servers. private key.",66f55d6e3063d294857001c8,4532,0.7075203579961225
T1098,adversaries may also assign mailbox folder permissions through individual folder permissions or roles.,mailbox folder permissions are frequently used to share a specific folder within a mailbox with a co-worker instead of delegating rights for the entire mailbox. administrators will often make a calendar public by granting read access to it for all authenticated users.,"mailbox folder permissions can be assigned through either individual folder permissions or roles, which are a collection of folder permissions.",the readitems permission grants read access to the items in a mailbox folder. the following roles include permissions that grant read access to folder items: • author • editor • noneditingauthor • owner • publishingeditor • publishingauthor • reviewer for a full listing of mailbox folder permissions and roles see https://docs.microsoft.com/en-us/powershell/module/ exchange/set-mailboxfolderpermission?view=exchange- ps#parameters.,66f55d6e3063d294857001c8,4774,0.7757896486416247
T1053,the different components of machete are executed by windows task scheduler.,initial access spearphishing t1193 emails contain a zipped file with malicious contents. attachment tries to get users to open links or attachments t1204 user execution that will execute the first component of machete.,execution other components of machete are executed t1053 scheduled task by windows task scheduler.,hidden files and t1158 malware files and folders are hidden for persistence. directories persistence all of the components are scheduled to ensure t1053 scheduled task persistence.,66f55da13063d294857001d2,2803,0.7307131977405948
T1115,darkcomet can steal data from the clipboard.,• list folders and files. • upload/download files.,• steal clipboard data.,"• grab/change wallpaper. in recent infections, this rat is named “cyrus client” (figure 16).",66f55e453063d294857001ee,4668,0.744149189521626
T1113,rtm can capture screenshots.,allakore allakore is a publicly available delphi- based rat that has consistently been used in sidecopy operations along with cetarat. malicious capabilities of allakore include: • keylogging.,• capture screenshots.,• list folders and files. • upload/download files.,66f55e453063d294857001ee,4665,0.7529826647119054
T1113,redleaves can capture screenshots.,allakore allakore is a publicly available delphi- based rat that has consistently been used in sidecopy operations along with cetarat. malicious capabilities of allakore include: • keylogging.,• capture screenshots.,• list folders and files. • upload/download files.,66f55e453063d294857001ee,4665,0.7140177172034063
T1113,zxshell can capture screenshots.,allakore allakore is a publicly available delphi- based rat that has consistently been used in sidecopy operations along with cetarat. malicious capabilities of allakore include: • keylogging.,• capture screenshots.,• list folders and files. • upload/download files.,66f55e453063d294857001ee,4665,0.731401070366259
T1115,darkcomet can steal data from the clipboard.,• list folders and files. • upload/download files.,• steal clipboard data.,"• grab/change wallpaper. in recent infections, this rat is named “cyrus client” (figure 16).",66f55e453063d294857001ee,4668,0.744149189521626
T1113,rtm can capture screenshots.,allakore allakore is a publicly available delphi- based rat that has consistently been used in sidecopy operations along with cetarat. malicious capabilities of allakore include: • keylogging.,• capture screenshots.,• list folders and files. • upload/download files.,66f55e453063d294857001ee,4665,0.7529826647119054
