label_tec,original_phrase,before,matching_report_sentence,after,report_id,rank,cosine_score
T1564,adversaries may attempt to hide artifacts associated with their behaviors to evade detection.,inter-process adversaries may abuse inter-process communication (ipc) t1559 communication mechanisms for local code or command execution. an adversary may compress and/or encrypt data that is collected archive collected data t1560.003 prior to exfiltration.,adversaries may attempt to hide artifacts associated with their hide artifacts t1564 behaviors to evade detection.,adversaries may abuse the windows service control manager to service execution t1569.002 execute malicious commands or payloads. adversaries may transfer tools or other files between systems in lateral tool transfer t1570 a compromised environment.,66f55ee03063d294857001f7,4513,0.875999800224953
T1105,files may be copied from an external adversary controlled system through the command and control channel to bring tools into the victim network or through alternate protocols with another tool such as ftp.,"after the sequence is completed, opening a port is often accomplished by the host based firewall, but could also be implemented by custom software. t1105 remote file files may be copied from one system to another to stage adversary copy tools or other files over the course of an operation.",files may be copied from an external adversary-controlled system through the command and control channel to bring tools into the victim network or through alternate protocols with another tool such as ftp.,"files can also be copied over on mac and linux with native tools like scp, rsync, and sftp. t1094 custom adversaries may communicate using a custom command and command and control protocol instead of encapsulating commands/data in an control protocol existing standard application layer protocol.",66f55ed73063d294857001f6,3944,1.0
T1105,"files can also be copied over on mac and linux with native tools like scp, rsync, and sftp.",t1105 remote file files may be copied from one system to another to stage adversary copy tools or other files over the course of an operation. files may be copied from an external adversary-controlled system through the command and control channel to bring tools into the victim network or through alternate protocols with another tool such as ftp.,"files can also be copied over on mac and linux with native tools like scp, rsync, and sftp.",t1094 custom adversaries may communicate using a custom command and command and control protocol instead of encapsulating commands/data in an control protocol existing standard application layer protocol. implementations include mimicking well-known protocols or developing custom protocols (including raw sockets) on top of fundamental protocols provided by tcp/ip/another standard network stack.,66f55ed73063d294857001f6,3945,1.0
T1559,adversaries may abuse inter-process communication  mechanisms for local code or command execution.,adversaries may establish persistence and elevate privileges by installer packages t1546.016 using an installer to trigger the execution of malicious content. adversaries may execute their own malicious payloads by dynamic linker hijacking t1547.006 hijacking environment variables the dynamic linker uses to load shared libraries.,inter-process adversaries may abuse inter-process communication (ipc) t1559 communication mechanisms for local code or command execution.,an adversary may compress and/or encrypt data that is collected archive collected data t1560.003 prior to exfiltration. adversaries may attempt to hide artifacts associated with their hide artifacts t1564 behaviors to evade detection.,66f55ee03063d294857001f7,4511,0.8510996488443444
T1056,adversaries may log user keystrokes to intercept credentials as the user types them.,"adversaries may attempt to get a listing of services running on network service discovery t1046 remote hosts and local network infrastructure devices, including those that may be vulnerable to remote software exploitation. adversaries may inject dynamic-link libraries (dlls) into dynamic-link library t1055.001 processes in order to evade process-based defenses as well as injection possibly elevate privileges.",adversaries may log user keystrokes to intercept credentials as keylogging t1056.001 the user types them.,adversaries may abuse powershell commands and scripts for powershell t1059.001 execution. adversaries may communicate using osi application layer application layer protocol t1071 protocols to avoid detection/network filtering by blending in with existing traffic.,66f55ee03063d294857001f7,4488,0.7871606202838792
T1570,adversaries may transfer tools or other files between systems in a compromised environment.,adversaries may attempt to hide artifacts associated with their hide artifacts t1564 behaviors to evade detection. adversaries may abuse the windows service control manager to service execution t1569.002 execute malicious commands or payloads.,adversaries may transfer tools or other files between systems in lateral tool transfer t1570 a compromised environment.,adversaries may tunnel network communications to and from a victim system within a separate protocol to avoid protocol tunneling t1572 detection/network filtering and/or enable access to otherwise unreachable systems. adversaries may employ a known encryption algorithm to conceal encrypted channel t1573 command and control traffic rather than relying on any inherent protections provided by a communication protocol.,66f55ee03063d294857001f7,4515,0.7976971315671642
T1570,files may be copied from one system to another to stage adversary tools or other files over the course of an operation.,"usually this series of packets consists of attempted connections to a predefined sequence of closed ports, but can involve unusual flags, specific strings or other unique characteristics. after the sequence is completed, opening a port is often accomplished by the host based firewall, but could also be implemented by custom software.",t1105 remote file files may be copied from one system to another to stage adversary copy tools or other files over the course of an operation.,"files may be copied from an external adversary-controlled system through the command and control channel to bring tools into the victim network or through alternate protocols with another tool such as ftp. files can also be copied over on mac and linux with native tools like scp, rsync, and sftp.",66f55ed73063d294857001f6,3943,0.8536776428697389
T1078,"adversaries may obtain and abuse credentials of a local account as a means of gaining initial access, persistence, privilege escalation, or defense evasion.",adversaries may communicate using the domain name system dns t1071.004 (dns) application layer protocol to avoid detection/network filtering by blending in with existing traffic. page 44 of 48 | product id: aa23-129a tlp:cleartlp:clear international partnership adversaries may stage collected data in a central location or data staged t1074 directory prior to exfiltration.,"adversaries may obtain and abuse credentials of existing valid accounts t1078 accounts as a means of gaining initial access, persistence, privilege escalation, or defense evasion.","adversaries may enumerate files and directories or may search in file and directory t1083 specific locations of a host or network share for certain discovery information within a file system. to disguise the source of malicious traffic, adversaries may chain multi-hop proxy t1090.003 together multiple proxies.",66f55ee03063d294857001f7,4495,0.7681213899003495
T1071,adversaries may communicate using application layer protocols associated with electronic mail delivery to avoid detection/network filtering by blending in with existing traffic.,adversaries may log user keystrokes to intercept credentials as keylogging t1056.001 the user types them. adversaries may abuse powershell commands and scripts for powershell t1059.001 execution.,adversaries may communicate using osi application layer application layer protocol t1071 protocols to avoid detection/network filtering by blending in with existing traffic.,adversaries may communicate using application layer protocols web protocols t1071.001 associated with web traffic to avoid detection/network filtering by blending in with existing traffic. adversaries may communicate using application layer protocols mail protocols t1071.003 associated with electronic mail delivery to avoid detection/network filtering by blending in with existing traffic.,66f55ee03063d294857001f7,4490,0.7172140614584777
T1071,adversaries may communicate using application layer protocols associated with electronic mail delivery to avoid detection/network filtering by blending in with existing traffic.,adversaries may abuse powershell commands and scripts for powershell t1059.001 execution. adversaries may communicate using osi application layer application layer protocol t1071 protocols to avoid detection/network filtering by blending in with existing traffic.,adversaries may communicate using application layer protocols web protocols t1071.001 associated with web traffic to avoid detection/network filtering by blending in with existing traffic.,adversaries may communicate using application layer protocols mail protocols t1071.003 associated with electronic mail delivery to avoid detection/network filtering by blending in with existing traffic. adversaries may communicate using the domain name system dns t1071.004 (dns) application layer protocol to avoid detection/network filtering by blending in with existing traffic.,66f55ee03063d294857001f7,4491,0.7413327309248555
T1071,adversaries may communicate using application layer protocols associated with electronic mail delivery to avoid detection/network filtering by blending in with existing traffic.,adversaries may communicate using osi application layer application layer protocol t1071 protocols to avoid detection/network filtering by blending in with existing traffic. adversaries may communicate using application layer protocols web protocols t1071.001 associated with web traffic to avoid detection/network filtering by blending in with existing traffic.,adversaries may communicate using application layer protocols mail protocols t1071.003 associated with electronic mail delivery to avoid detection/network filtering by blending in with existing traffic.,adversaries may communicate using the domain name system dns t1071.004 (dns) application layer protocol to avoid detection/network filtering by blending in with existing traffic. page 44 of 48 | product id: aa23-129a tlp:cleartlp:clear international partnership adversaries may stage collected data in a central location or data staged t1074 directory prior to exfiltration.,66f55ee03063d294857001f7,4492,0.8966880947296414
T1587,adversaries may develop malware and malware components that can be used during targeting.,adversaries may execute their own malicious payloads by side- dll side-loading t1574.002 loading dlls. adversaries may compromise third-party infrastructure that can compromise infrastructure t1584 be used during targeting.,adversaries may develop malware and malware components that malware t1587.001 can be used during targeting.,"page 46 of 48 | product id: aa23-129a tlp:cleartlp:clear international partnership adversaries may buy and/or steal capabilities that can be used obtain capabilities t1588 during targeting. adversaries may upload, install, or otherwise set up capabilities stage capabilities t1608 that can be used during targeting.",66f55ee03063d294857001f7,4522,0.8094011976586835
T1036,adversaries may attempt to manipulate features of their artifacts to make them appear legitimate or benign to users and/or security tools.,"adversaries may attempt to make an executable or file difficult to obfuscated files or t1027 discover or analyze by encrypting, encoding, or otherwise information obfuscating its contents on the system or in transit. adversaries may perform software packing or virtual machine software packing t1027.002 software protection to conceal their code.",adversaries may attempt to manipulate features of their artifacts masquerading t1036 to make them appear legitimate or benign to users and/or security tools.,"adversaries may sniff network traffic to capture information about network sniffing t1040 an environment, including authentication material passed over the network. adversaries may attempt to get a listing of services running on network service discovery t1046 remote hosts and local network infrastructure devices, including those that may be vulnerable to remote software exploitation.",66f55ee03063d294857001f7,4484,0.878203913186468
T1112,"adversaries may interact with the windows registry to hide configuration information within registry keys, remove information as part of cleaning up, or as part of other techniques to aid in persistence and execution.",adversaries may create multiple stages for command and control multi-stage channels t1104 that are employed under different conditions or for certain functions. adversaries may interact with the native os application native api t1106 programming interface (api) to execute behaviors.,"adversaries may interact with the windows registry to hide configuration information within registry keys, remove modify registry t1112 information as part of cleaning up, or as part of other techniques to aid in persistence and execution.","once established within a system or network, an adversary may automated collection t1119 use automated techniques for collecting internal data. adversaries may encode data to make the content of command data encoding t1132 and control traffic more difficult to detect.",66f55ee03063d294857001f7,4501,0.933816478200685
T1104,adversaries may create multiple stages for command and control that are employed under different conditions or for certain functions.,"to disguise the source of malicious traffic, adversaries may chain multi-hop proxy t1090.003 together multiple proxies. adversaries may use an osi non-application layer protocol for non-application layer t1095 communication between host and c2 server or among infected protocol hosts within a network.",adversaries may create multiple stages for command and control multi-stage channels t1104 that are employed under different conditions or for certain functions.,"adversaries may interact with the native os application native api t1106 programming interface (api) to execute behaviors. adversaries may interact with the windows registry to hide configuration information within registry keys, remove modify registry t1112 information as part of cleaning up, or as part of other techniques to aid in persistence and execution.",66f55ee03063d294857001f7,4499,0.8365967386179416
T1090,"to disguise the source of malicious traffic, adversaries may chain together multiple proxies.","adversaries may obtain and abuse credentials of existing valid accounts t1078 accounts as a means of gaining initial access, persistence, privilege escalation, or defense evasion. adversaries may enumerate files and directories or may search in file and directory t1083 specific locations of a host or network share for certain discovery information within a file system.","to disguise the source of malicious traffic, adversaries may chain multi-hop proxy t1090.003 together multiple proxies.",adversaries may use an osi non-application layer protocol for non-application layer t1095 communication between host and c2 server or among infected protocol hosts within a network. adversaries may create multiple stages for command and control multi-stage channels t1104 that are employed under different conditions or for certain functions.,66f55ee03063d294857001f7,4497,0.7392795414703097
T1106,adversaries may interact with the native os application programming interface  to execute behaviors.,adversaries may use an osi non-application layer protocol for non-application layer t1095 communication between host and c2 server or among infected protocol hosts within a network. adversaries may create multiple stages for command and control multi-stage channels t1104 that are employed under different conditions or for certain functions.,adversaries may interact with the native os application native api t1106 programming interface (api) to execute behaviors.,"adversaries may interact with the windows registry to hide configuration information within registry keys, remove modify registry t1112 information as part of cleaning up, or as part of other techniques to aid in persistence and execution. once established within a system or network, an adversary may automated collection t1119 use automated techniques for collecting internal data.",66f55ee03063d294857001f7,4500,0.7981170508636624
T1046,"adversaries may attempt to get a listing of services running on remote hosts, including those that may be vulnerable to remote software exploitation.","adversaries may attempt to manipulate features of their artifacts masquerading t1036 to make them appear legitimate or benign to users and/or security tools. adversaries may sniff network traffic to capture information about network sniffing t1040 an environment, including authentication material passed over the network.","adversaries may attempt to get a listing of services running on network service discovery t1046 remote hosts and local network infrastructure devices, including those that may be vulnerable to remote software exploitation.",adversaries may inject dynamic-link libraries (dlls) into dynamic-link library t1055.001 processes in order to evade process-based defenses as well as injection possibly elevate privileges. adversaries may log user keystrokes to intercept credentials as keylogging t1056.001 the user types them.,66f55ee03063d294857001f7,4486,0.7950134644368245
T1135,adversaries may look for folders and drives shared on remote systems as a means of identifying sources of information to gather as a precursor for collection and to identify potential systems of interest for lateral movement.,adversaries may encode data to make the content of command data encoding t1132 and control traffic more difficult to detect. adversaries may encode data with a non-standard data encoding non-standard encoding t1132.002 system to make the content of command and control traffic more difficult to detect.,adversaries may look for folders and drives shared on remote systems as a means of identifying sources of information to network share discovery t1135 gather as a precursor for collection and to identify potential systems of interest for lateral movement.,deobfuscate/decode files adversaries may use obfuscated files or information to hide t1140 or information artifacts of an intrusion from analysis. exploit public-facing adversaries may attempt to exploit a weakness in an internet- t1190 application facing host or system to initially access a network.,66f55ee03063d294857001f7,4505,0.9143507482309509
T1040,"adversaries may sniff network traffic to capture information about an environment, including authentication material passed over the network.",adversaries may perform software packing or virtual machine software packing t1027.002 software protection to conceal their code. adversaries may attempt to manipulate features of their artifacts masquerading t1036 to make them appear legitimate or benign to users and/or security tools.,"adversaries may sniff network traffic to capture information about network sniffing t1040 an environment, including authentication material passed over the network.","adversaries may attempt to get a listing of services running on network service discovery t1046 remote hosts and local network infrastructure devices, including those that may be vulnerable to remote software exploitation. adversaries may inject dynamic-link libraries (dlls) into dynamic-link library t1055.001 processes in order to evade process-based defenses as well as injection possibly elevate privileges.",66f55ee03063d294857001f7,4485,0.8753534882009297
T1095,adversaries may use a non-application layer protocol for communication between host and c2 server or among infected hosts within a network.,"adversaries may enumerate files and directories or may search in file and directory t1083 specific locations of a host or network share for certain discovery information within a file system. to disguise the source of malicious traffic, adversaries may chain multi-hop proxy t1090.003 together multiple proxies.",adversaries may use an osi non-application layer protocol for non-application layer t1095 communication between host and c2 server or among infected protocol hosts within a network.,adversaries may create multiple stages for command and control multi-stage channels t1104 that are employed under different conditions or for certain functions. adversaries may interact with the native os application native api t1106 programming interface (api) to execute behaviors.,66f55ee03063d294857001f7,4498,0.8561674430936843
T1132,adversaries may encode data with a non-standard data encoding system to make the content of command and control traffic more difficult to detect.,"adversaries may interact with the windows registry to hide configuration information within registry keys, remove modify registry t1112 information as part of cleaning up, or as part of other techniques to aid in persistence and execution. once established within a system or network, an adversary may automated collection t1119 use automated techniques for collecting internal data.",adversaries may encode data to make the content of command data encoding t1132 and control traffic more difficult to detect.,adversaries may encode data with a non-standard data encoding non-standard encoding t1132.002 system to make the content of command and control traffic more difficult to detect. adversaries may look for folders and drives shared on remote systems as a means of identifying sources of information to network share discovery t1135 gather as a precursor for collection and to identify potential systems of interest for lateral movement.,66f55ee03063d294857001f7,4503,0.8269319992049962
T1132,adversaries may encode data with a non-standard data encoding system to make the content of command and control traffic more difficult to detect.,"once established within a system or network, an adversary may automated collection t1119 use automated techniques for collecting internal data. adversaries may encode data to make the content of command data encoding t1132 and control traffic more difficult to detect.",adversaries may encode data with a non-standard data encoding non-standard encoding t1132.002 system to make the content of command and control traffic more difficult to detect.,adversaries may look for folders and drives shared on remote systems as a means of identifying sources of information to network share discovery t1135 gather as a precursor for collection and to identify potential systems of interest for lateral movement. deobfuscate/decode files adversaries may use obfuscated files or information to hide t1140 or information artifacts of an intrusion from analysis.,66f55ee03063d294857001f7,4504,0.881978330446374
T1003,"adversaries may attempt to dump credentials to obtain account login and credential material, normally in the form of a hash or a clear text password, from the operating system and software.",adversaries may obfuscate command and control traffic to make data obfuscation t1001 it more difficult to detect. adversaries may impersonate legitimate protocols or web service protocol impersonation t1001.003 traffic to disguise command and control activity and thwart analysis efforts.,"page 43 of 48 | product id: aa23-129a tlp:cleartlp:clear international partnership adversaries may attempt to dump credentials to obtain account os credential dumping t1003 login and credential material, normally in the form of a hash or a clear text password, from the operating system and software.","adversaries may use rootkits to hide the presence of programs, rootkit t1014 files, network connections, services, drivers, and other system components. adversaries may attempt to make an executable or file difficult to obfuscated files or t1027 discover or analyze by encrypting, encoding, or otherwise information obfuscating its contents on the system or in transit.",66f55ee03063d294857001f7,4480,0.7295699111573988
T1027,"adversaries may attempt to make an executable or file difficult to discover or analyze by encrypting, encoding, or otherwise obfuscating its contents on the system or in transit.","page 43 of 48 | product id: aa23-129a tlp:cleartlp:clear international partnership adversaries may attempt to dump credentials to obtain account os credential dumping t1003 login and credential material, normally in the form of a hash or a clear text password, from the operating system and software. adversaries may use rootkits to hide the presence of programs, rootkit t1014 files, network connections, services, drivers, and other system components.","adversaries may attempt to make an executable or file difficult to obfuscated files or t1027 discover or analyze by encrypting, encoding, or otherwise information obfuscating its contents on the system or in transit.",adversaries may perform software packing or virtual machine software packing t1027.002 software protection to conceal their code. adversaries may attempt to manipulate features of their artifacts masquerading t1036 to make them appear legitimate or benign to users and/or security tools.,66f55ee03063d294857001f7,4482,0.9299575614174911
